"","Start.Date","End.Date","Response.Type","Progress","Duration..in.seconds.","Finished","Recorded.Date","Response.ID","Distribution.Channel","How.would.you.rate.the.workshop.in.general.","How.would.you.rate.the.teaching.material.","How.would.you.rate.the.trainers.teachers.","What.aspects.did.you.like.most.","What.would.you.like.to.see.changed..What.could.be.better.different.","Do.you.think.that.you.will.apply.ABM.to.your.own.research..If.yes..can.you.elaborate....Selected.Choice","Do.you.think.that.you.will.apply.ABM.to.your.own.research..If.yes..can.you.elaborate....Yes..please.explain....Text","Do.you.have.any.general.feedback.for.us.","Workshop"
"67","2023-12-12 15:20:21","2023-12-12 15:21:40","IP Address",100,79,"True","2023-12-12 15:21:41","R_2wghWVFWn0ofTAp","anonymous","Good","Good","Good","Being allowed to apply the concepts from the tutorial and figure stuff out on our own","","No","","","202312_Leiden"
"68","2023-12-12 15:31:07","2023-12-12 15:33:00","IP Address",100,113,"True","2023-12-12 15:33:01","R_1Ed5qUC2UvDxgIm","anonymous","Sufficient","Sufficient","Sufficient","The step by step and guiding tutorial","Maybe more examples? I did not really miss it in class though we had a hard time starting the project due to lack of prior knowledge about the possibilities of the program","No","","","202312_Leiden"
"69","2023-12-12 16:38:52","2023-12-12 16:43:01","IP Address",100,248,"True","2023-12-12 16:43:01","R_2usvRUyhccu2fQQ","qr","Good","Good","Excellent","That the software is very accessible and easy to use, even for people less acquainted with coding ","Sometimes the tutorial crashed, making you re-do several steps before you could contribute where you were","No","","Really good structure with tutorials before the in class section, because this familiarized us with the programme ","202312_Leiden"
"70","2023-12-13 19:01:25","2023-12-13 19:08:55","IP Address",100,449,"True","2023-12-13 19:08:55","R_2CBSU7x5GrotyFy","anonymous","Good","Good","Good","The follow-along coding style.","The follow along coding is a bit awkward, often the first line gets deleted. Just a general bug","No","","Really good!","202312_Leiden"
"71","2024-01-22 16:44:31","2024-01-22 16:45:03","IP Address",100,31,"True","2024-01-22 16:45:04","R_4lJiutDbOKqMsor","anonymous","Excellent","Excellent","Excellent","everything","nothing","Yes, please explain.","for my research","congrats!","202401_Aarhus"
"72","2024-01-22 16:44:32","2024-01-22 16:45:44","IP Address",100,72,"True","2024-01-22 16:45:44","R_2rtCmLvXVXT1dTP","anonymous","Excellent","Excellent","Excellent","The presentations were clear and the workshop material is great!","","Yes, please explain.","I will look into applying ABM in anthropology and the social sciences in general","Thank you for this great work!","202401_Aarhus"
"73","2024-01-22 16:44:35","2024-01-22 16:45:53","IP Address",100,77,"True","2024-01-22 16:45:53","R_4aDn9oSHkEMoYW8","anonymous","Excellent","Excellent","Excellent","Very user friedly of begginer users and easy to follow through ","",NA,"","","202401_Aarhus"
"74","2024-01-22 16:45:10","2024-01-22 16:46:25","IP Address",100,75,"True","2024-01-22 16:46:26","R_4JDlC2D4bknIQjP","anonymous","Excellent","Excellent","Excellent","i think the tutorial is fantastic and it was great having support available ","More of these! ","Yes, please explain.","Yes, my PhD formed a static model of Catalhoyuk's agricultural system and i would love to expand it to an ABM model ","Would love to attend more workshops on this, more classes! ","202401_Aarhus"
"75","2024-01-22 16:44:37","2024-01-22 16:47:39","IP Address",100,181,"True","2024-01-22 16:47:39","R_8DokfVBDDnWMtPH","anonymous","Good","Excellent","Excellent","I really liked the tutorials, I found them straightforward, easy to follow, and they contained just enough information without being overwhelming","Perhaps making the materials available earlier on the workshop day, as it took some time to figure out the download etc.","Yes, please explain.","While it might not be applicable to my research right away, this is something I would be very keen to explore moving forward","I really enjoyed learning about ABM and specifics of the software as a complete beginner, thank you!","202401_Aarhus"
"76","2024-01-22 16:45:13","2024-01-22 16:48:25","IP Address",100,191,"True","2024-01-22 16:48:25","R_8dQJQJfgUJvrH7U","anonymous","Excellent","Excellent","Excellent","The tutorial is incredibly complete and clear and answers all your doubts in advance.","","Yes, please explain.","since I'm in a master degree, I could consider the possibility to apply ABM for the final thesis.","Very well structures course, especially for beginners.","202401_Aarhus"
"77","2024-01-22 16:44:34","2024-01-22 16:48:58","IP Address",100,264,"True","2024-01-22 16:48:59","R_50pFpBEWndcqlpE","anonymous","Sufficient","Good","Excellent","The tutorials are self explanatory","Create a tutorial taking us step by step (including code writing) into the creation of the Ansazi model. Tutorials 2-4 are great but we are left not knowing how to sucessively create a model with NetLogo","Yes, please explain.","Modeling pottery use throughout a region of the Near East","Great team. Would very much like to have another session after we would have played with NetLogo","202401_Aarhus"
"78","2024-01-22 16:44:43","2024-01-22 16:49:55","IP Address",100,311,"True","2024-01-22 16:49:55","R_1NxAa6XGdBMI3zL","anonymous","Excellent","Excellent","Excellent","Interactivity, accessibility and the focus on practical skills, permission to go at your own pace and revisit the materials later","There could be a brief mention of some recent research in archaeology that applied ABM ","No","","Thank you for putting everything together! ","202401_Aarhus"
"79","2024-01-22 16:44:58","2024-01-22 16:51:03","IP Address",100,364,"True","2024-01-22 16:51:03","R_5MRrk6Xc8J9ZLHy","anonymous","Excellent","Good","Good","The mixed structure (individual learning+lesson)","Nothing ","Yes, please explain.","I think I will do more research on integrating socio-ecological models and ABM. I would like to explore the possibility of applying ABM in the Human-Environment relationship in wetland and coastal environments. ","-","202401_Aarhus"
"80","2024-01-22 16:52:01","2024-01-22 16:53:03","IP Address",100,61,"True","2024-01-22 16:53:03","R_6fecP3QASWYs83J","anonymous","Excellent","Excellent","Excellent","Easy to follow tutorial that didn't expect you to have any preexisting knowledge","","No","","No, really enjoyed it and I look forward to practicing more. ","202401_Aarhus"
"81","2024-01-22 16:51:10","2024-01-22 16:55:23","IP Address",100,252,"True","2024-01-22 16:55:24","R_7V0BhFnzXBJt0ZP","anonymous","Good","Sufficient","Excellent","easy-to-go introduction through NetLogo","","Yes, please explain.","I am currently worknig on my phd disseration regarding landscape anthropogenic and environmental dynamics in a 3 thousand year time span. so in order to be able to predict what is already lost in the environment, I would like to use ABM to recreate and have an overview of the data which might have been lost.","The workshop was really great, and I would follow up all the outcomes and further elaborations.","202401_Aarhus"
"82","2024-01-22 16:56:06","2024-01-22 17:01:21","IP Address",100,314,"True","2024-01-22 17:01:21","R_202n5cYoe0Eh74v","anonymous","Good","Good","Good","","I'd suggest a little bit more guided training as part of the online course while letting participants do the self-tutorials afterwards","Yes, please explain.","no specific research question at the moment, but might make use of it in the future","","202401_Aarhus"
"83","2024-01-22 16:44:34","2024-01-22 17:08:44","IP Address",100,1449,"True","2024-01-22 17:08:44","R_5HFaBvXU66asG8M","anonymous","Excellent","Excellent","Excellent","Easy to follow tutorial with clear instructions and explanations","Possibly more interactive with the instructors, but this is hard over zoom!","Yes, please explain.","Hoping to use ABM to model the use, reuse, and recycle of copper alloy objects in Roman and early medieval Britain for the project that I am working on (REMADE - Roman and Early Medieval Alloys Defined)","Thank you so much for putting on this workshop and for making it open/accessible to so many archaeologists!","202401_Aarhus"
"84","2024-01-25 10:31:01","2024-01-25 10:32:10","IP Address",100,68,"True","2024-01-25 10:32:11","R_10diUeZ1akcsukA","anonymous","Good","Good","Good","the accessability","a little more examples ","Yes, please explain.","I'll use it in my Phd for tradenetworks","Excellent materials!","202401_Aarhus"
"85","2024-01-25 10:31:03","2024-01-25 10:32:46","IP Address",100,103,"True","2024-01-25 10:32:47","R_3Y35EEogNJPtRuL","anonymous","Excellent","Excellent","Excellent","Being able to work through the tutorial in my own time. ","-","No","","Thank you! ","202401_Aarhus"
"86","2024-01-25 10:31:26","2024-01-25 10:33:06","IP Address",100,100,"True","2024-01-25 10:33:07","R_431frXOVl5foHL3","anonymous","Good","Excellent","Excellent","learning the tutorial","maybe go through the tutorial with the participants once before letting us explore by ourselves","Yes, please explain.","I do research on rock art of Southeast Asia, was thinking that maybe this can help to identify how rock art locations were selected","n/a","202401_Aarhus"
"87","2024-01-25 10:31:09","2024-01-25 10:33:21","IP Address",100,131,"True","2024-01-25 10:33:21","R_480XhJTkgZMyDPX","anonymous","Excellent","Excellent","Excellent","The introduction was very clearly explained and the tutorials are engaging and easy to follow",".","Yes, please explain.","I want to try to use it but I need to learn more to understand how to do that. ","I would have like a bit of a longer introduction before starting with the materials, maybe with an in-depth example of the use of ABM. ","202401_Aarhus"
"88","2024-01-25 10:31:29","2024-01-25 10:33:39","IP Address",100,129,"True","2024-01-25 10:33:39","R_5HnNcQGBnsP3bNb","anonymous","Sufficient","Good","Sufficient","It has been nice to be introduced to ABM as a methodology. ","I would like more examples on how to use these models, or ideas where it may be (or have been used). ","Yes, please explain.","I would really like to make some sort of model based on bronze age metals in Italy, however I am unsure how to go about this. I believe the method may be useful. Either that or create an ABM over the rise and subsequent fall of the terramare peoples. ","Thank you for this opportunity. ","202401_Aarhus"
"89","2024-01-25 10:31:26","2024-01-25 10:36:31","IP Address",100,304,"True","2024-01-25 10:36:31","R_433KNhLA2bXQtXo","anonymous","Good","Excellent","Excellent","The fact that the explanations were short and concise, but at the same time very practical.","The presentation at the beginning was a bit too fast to follow, maybe 5 more minutes would be enough to follow with less 'rush'.","Yes, please explain.","Not knowing the theory I've never considered it, but dealing with local community-wetland relationships I think I'll think about how to apply it.","","202401_Aarhus"
"90","2024-01-25 10:31:40","2024-01-25 10:36:51","IP Address",100,311,"True","2024-01-25 10:36:52","R_4VeIaMiICKmuVgP","anonymous","Excellent","Good","Good","Simple step-by-step which is very easy to follow","Have the big boxes of text not appear (in the first course part) while the simulation is going on but maybe before or after","No","","","202401_Aarhus"
"91","2024-01-25 10:30:54","2024-01-25 10:36:57","IP Address",100,363,"True","2024-01-25 10:36:58","R_4CZqz5DbL3EztN0","anonymous","Excellent","Excellent","Excellent","The step by step process of the course is very easy to follow.","Hard to tell at this point, would need to finish the course first. ","Yes, please explain.","I have some reasonably large data sets that I've used in other projects and it would be interesting to see if there are some ways to reutilize the data with an ABM focus. ","I really appreciate this workshop. I've had an interest in ABM for a while but haven't had the time to sit down and start working through the Agent-Based Modeling for Archaeology book. This workshop provides an easy onramp to start digging further into more advanced materials. ","202401_Aarhus"
"92","2024-01-25 10:30:55","2024-01-25 10:36:59","IP Address",100,364,"True","2024-01-25 10:36:59","R_2uV8h7MrGVqiUCY","anonymous","Excellent","Excellent","Excellent","The fact that they had a quick introduction and then we were given enough time to go through the tutorial on our own pace. Since it was something totally new to me, that personal time was a great idea. Also the material and the links that we were provided so we can do our own research and reading afterwards. Very friendly speakers!    ","Nothing particular. ","No","","Keep up the good work! Thank you!","202401_Aarhus"
"93","2024-01-25 10:31:24","2024-01-25 10:37:30","IP Address",100,365,"True","2024-01-25 10:37:30","R_2FP2XkQbNn7b9mh","anonymous","Good","Excellent","Excellent","A soft introduction and the very friendly/ helpful guide in the tutorials.","A better introduction on how, the tutorial worked. Just shortly saying: ""Okay so you're going to open a webbrowser by following that file, then it will take you directly to the webpage. Also maybe taking us a bit more into the coding tap, because this is really the space that is unfamiliar to archaeologists, or at least the most of us.","Yes, please explain.","I used ABM for my master's dissertation and is also using it in my PhD project is using ABM for archaeological investigation on hominin dispersal. Still not sure whether it will be done in NetLogo, but I do like the platform and especially the easy coding language.","Thank you for doing this, this methodology should be spread more out into archaeological circles, since it's such a useful tool.","202401_Aarhus"
"94","2024-01-25 10:36:25","2024-01-25 10:38:12","IP Address",100,107,"True","2024-01-25 10:38:12","R_6b2lhHttuaJIGQy","anonymous","Good","Excellent","Good","","Go over the Tutorial in a bit more detail","Yes, please explain.","Always aimed at using more formal models to better understand my research","","202401_Aarhus"
"95","2024-01-25 10:31:48","2024-01-25 10:40:03","IP Address",100,494,"True","2024-01-25 10:40:04","R_6FWkqDs81gYRl3r","anonymous","Sufficient","Sufficient","Sufficient","","","No","","thank you so much, it will be nice if there is any exercises  ","202401_Aarhus"
"96","2024-01-25 10:51:27","2024-01-25 10:54:58","IP Address",100,211,"True","2024-01-25 10:54:58","R_5f7Sm9b2IlKgkVv","anonymous","Excellent","Excellent","Good","Very easy go to guide","","Yes, please explain.","Hopefully this tutorial introduction initiates my adventure into ABM and to research","","202401_Aarhus"
"97","2024-01-25 10:51:33","2024-01-25 10:57:01","IP Address",100,327,"True","2024-01-25 10:57:01","R_2TF30HHQhCMxIsu","anonymous","Excellent","Excellent","Excellent","","More interaction","Yes, please explain.","I will try","Perhaps making it more interactive with the people","202401_Aarhus"
"98","2024-01-25 10:51:39","2024-01-25 10:57:16","IP Address",100,336,"True","2024-01-25 10:57:16","R_5MMWzOMOnWfLUI1","anonymous","Excellent","Excellent","Excellent","the step by step tutorial and how accessible it is","n/a","Yes, please explain.","i would like to test using abm for modelling navigation in a megalithic landscape, and how this is affected by the placement of dolmens. for starters.","thank you very much for making this an accessible topic!","202401_Aarhus"
"99","2024-01-25 10:30:49","2024-01-25 11:00:41","IP Address",100,1792,"True","2024-01-25 11:00:42","R_4i9QheKSmoHHERP","anonymous","Good","Excellent","Good","The training materials are very thorough but divided in comprehensible parts which makes it easy to understand.","There are several bug in the interface but those can only be cleaned by more testing and sharing.","Yes, please explain.","I see the potential of ABM in archaeology but will need more practice with it in order to figure out how to best implement it.","The text fields of this survey could be made larger so the whole text can be visible.","202401_Aarhus"
"100","2024-01-25 10:30:51","2024-01-25 11:03:32","IP Address",100,1961,"True","2024-01-25 11:03:33","R_41FaAewjnr4niPJ","anonymous","Excellent","Excellent","Excellent","Really well-made interactive material","Maybe a longer explanation of the case study in the intro, or after the training. For instance discussing a published case study while looking at the code behind it","Yes, please explain.","Yes, I will surely play with NetLogo (if I am able to learn it) or move to more familiar programming languages. It can be a useful way to model plant dispersal or behavioral research (i.e. the adoption of certain innovations)","","202401_Aarhus"
"101","2024-01-25 16:30:05","2024-01-25 16:30:41","IP Address",100,35,"True","2024-01-25 16:30:42","R_2mUPGmQ9bt8TzmV","anonymous","Good","Good","Good","","","Yes, please explain.","","","202401_Aarhus"
"102","2024-01-25 16:30:06","2024-01-25 16:40:50","IP Address",100,643,"True","2024-01-25 16:40:50","R_2qb6FPU8iBWKeC5","anonymous","Good","Good","Good","The interactiveness and the possibility to ask questions as the tutorials go","","Yes, please explain.","It's more intuitive than a conviction at this point, but as my research focuses on human mobility in regard to the surrounding environement, there could be some potential","No, just thanks :)","202401_Aarhus"
"103","2024-01-25 16:40:00","2024-01-25 16:43:41","IP Address",100,221,"True","2024-01-25 16:43:42","R_2tGd9ycT9Q2hX3B","anonymous","Excellent","Good","Excellent","I liked that you had a very interesting grip of ABM, and that you have provided lots of extra material for further reading.","I think perhaps you could divide it to two - absolute beginner and a more advanced, where you could elaborate more on data modelling and data acquisition, so a bit more about the 'backend' of the process. ","Yes, please explain.","I primarily use geospatial statistics and modelling, but I think it would be interesting to run some ABM on my data as well, so I might give it a go.","Thanks for the fun and interesting initiative!","202401_Aarhus"
"104","2024-01-25 16:44:29","2024-01-25 16:47:44","IP Address",100,195,"True","2024-01-25 16:47:45","R_44zWH0XCKOIG3T0","anonymous","Good","Excellent","Excellent","the easy- to- understand way the presenters explained ABM","I`m not sure yet","Yes, please explain.","I hope to use it in my doctoral research","keep doing the good job","202401_Aarhus"
"105","2024-01-25 16:30:08","2024-01-25 16:48:22","IP Address",100,1093,"True","2024-01-25 16:48:22","R_4rPsky1fwzUFr53","anonymous","Good","Excellent","Good","","","Yes, please explain.","","","202401_Aarhus"
"106","2024-01-25 16:51:00","2024-01-25 16:55:45","IP Address",100,285,"True","2024-01-25 16:55:46","R_7k1UB5InCjoMpX2","anonymous","Excellent","Excellent","Excellent","The step-by-step tutorials are both great at guiding through the netlogo interface while also building up the skills to understand how to navigate independently.  The examples are incredibly helpful!  ","N/A, very helpful!","Yes, please explain.","I have been working towards examining household archaeology using ABM, setting the bound space as the House space and then providing various social identifiers and actions to agents to help see what kind of interactions may result in different kinds of archaeology material","Thank you so much for offering this workshop! If there's an ABM listserv/discord/community hub for discussing/using ABM directly with data would love to join","202401_Aarhus"
"107","2024-01-25 16:54:39","2024-01-25 16:58:09","IP Address",100,209,"True","2024-01-25 16:58:09","R_5YqVJO8uPcQoHfF","anonymous","Excellent","Excellent","Excellent","I loved how accessible the tutorials are. I can work at my own pace and get guided helpfully","Potentially an overall .pdf laying out each tutorial's objectives - just so at the end of all the tutorials I can see an overview of what I've learnt ","Yes, please explain.","I hope to apply this in potential PhD research to Iron Age populations in Britain","Everything was superb, really informative, accessible and helpful. In a short space of time, the power of ABM was conveyed :)","202401_Aarhus"
"108","2024-01-25 16:30:06","2024-01-25 16:59:02","IP Address",100,1735,"True","2024-01-25 16:59:02","R_2sTjHiuPKTl2pmE","anonymous","Good","Excellent","Excellent","Very simple and informative guiding into ABM.","Everything was good. ","Yes, please explain.","I am not sure but I may use it to understand the seasonal migration patterns of prehistoric species.","No, thank you!","202401_Aarhus"
"109","2024-01-25 16:53:42","2024-01-25 16:59:09","IP Address",100,327,"True","2024-01-25 16:59:10","R_7QDafli9ZRxkh60","anonymous","Good","Excellent","Good","the interactive learning with the web setting, alongside an online Q&A session","more case studies","Yes, please explain.","mechanisms of urban process","Smoothly organised and practically instructive","202401_Aarhus"
"110","2024-01-25 16:30:10","2024-01-25 17:01:04","IP Address",100,1854,"True","2024-01-25 17:01:05","R_8g6DZXKUYigTSHv","anonymous","Excellent","Excellent","Excellent","We were guided step by step through the entire process and it was really usefull","Having zero knowledge at all about ABM I found it perfect",NA,"","","202401_Aarhus"
"111","2024-01-25 16:30:07","2024-01-25 17:01:21","IP Address",100,1874,"True","2024-01-25 17:01:22","R_8w1sxAuJkbqmECh","anonymous","Excellent","Excellent","Excellent","Everthing was fine and the authors were always ready to help","","Yes, please explain.","I will try to apply ABM to my reseach about the evolution of the bronze age communities in portuguese territory (Estremadura region)","","202401_Aarhus"
"112","2024-01-25 16:42:16","2024-01-25 17:01:30","IP Address",100,1153,"True","2024-01-25 17:01:30","R_2lR1WdC74bx8SQx","anonymous","Good","Excellent","Good","I liked that the material used for the tutorial is based on real archaeological case studies. Also step-by-step interactive process seems like an appropriate way to learn ABM.","The participants might have questions after they have completed all tutorials. So the follow-up Q/A session would be nice, or the possibility to ask questions once the participants know more of ABM (maybe there is a way to ask questions after the tutorials already).","Yes, please explain.","It seems like a great tool to use in Paleolithic archaeology. I am mostly interested in human niche construction. ","","202401_Aarhus"
"113","2024-01-25 16:30:34","2024-01-25 17:03:19","IP Address",100,1964,"True","2024-01-25 17:03:19","R_8q80cAepv0SlXPz","anonymous","Excellent","Good","Excellent","The training part","More explanations/ examples about the practical uses of it in archaeology","Yes, please explain.","Reconstruction of Palaeoenvironments","Thank you a lot! Hope to see you in other exciting projects also in the future!","202401_Aarhus"
"114","2024-01-25 16:30:18","2024-01-25 21:06:32","IP Address",100,16573,"True","2024-01-25 21:06:33","R_6M4LdHMIKYF4JKW","anonymous","Good","Excellent","Excellent","Everything was very clear and easy to follow","I think seeing a live presentation of someone completing the ABM would be beneficial and talk about it's application in further details with examples.","Yes, please explain.","Looking at the progression of curse tablets through the Roman Empire","Good overall program!","202401_Aarhus"
